{
  "basics": {
    "name": "Asha Raman",
    "label": "Product Analyst",
    "email": "asha.raman@example.com",
    "location": "Bengaluru, India",
    "url": "https://example.com",
    "profiles": [],
    "claimIds": ["ev-identity"],
    "summary": "Product analyst with four years of experience translating customer and operational data into product decisions for mobility and learning platforms.",
    "summaryClaimIds": ["ev-years", "ev-domain"]
  },
  "skills": [
    {
      "name": "Analysis",
      "keywords": ["SQL", "Python", "Experiment design", "Dashboarding"],
      "claimIds": ["ev-tools"]
    },
    {
      "name": "Product",
      "keywords": ["Funnel analysis", "Customer research", "Requirements discovery"],
      "claimIds": ["ev-product"]
    }
  ],
  "work": [
    {
      "name": "Meridian Mobility",
      "position": "Product Analyst",
      "location": "Bengaluru, India",
      "startDate": "2023-07",
      "endDate": "present",
      "claimIds": ["ev-current-role"],
      "highlights": [
        {
          "text": "Built a weekly activation funnel in SQL and Python that helped the product team identify two onboarding drop-off points.",
          "claimIds": ["ev-funnel"]
        },
        {
          "text": "Designed an experiment for a revised driver checklist; the confirmed release increased first-week completion from 62% to 71%.",
          "claimIds": ["ev-experiment"]
        },
        {
          "text": "Combined support themes with usage data to prioritize three reliability fixes for the quarterly roadmap.",
          "claimIds": ["ev-roadmap"]
        }
      ]
    },
    {
      "name": "Northstar Learning",
      "position": "Data Analyst",
      "location": "Remote",
      "startDate": "2021-06",
      "endDate": "2023-06",
      "claimIds": ["ev-prior-role"],
      "highlights": [
        {
          "text": "Automated the monthly learner-retention report, reducing preparation time from two days to three hours.",
          "claimIds": ["ev-automation"]
        },
        {
          "text": "Partnered with product and curriculum teams to define adoption metrics for four new course features.",
          "claimIds": ["ev-adoption"]
        }
      ]
    }
  ],
  "projects": [
    {
      "name": "Public Transit Reliability Explorer",
      "description": "Personal data-visualization project using an openly licensed transit feed.",
      "url": "https://example.com",
      "startDate": "2024-02",
      "endDate": "2024-05",
      "claimIds": ["ev-project"],
      "highlights": [
        {
          "text": "Created a reproducible Python pipeline and dashboard for comparing route reliability across time periods.",
          "claimIds": ["ev-project"]
        }
      ]
    }
  ],
  "education": [
    {
      "institution": "Example Institute of Technology",
      "area": "Information Science",
      "studyType": "Bachelor of Engineering",
      "location": "Mysuru, India",
      "endDate": "2021",
      "claimIds": ["ev-education"]
    }
  ],
  "certificates": [
    {
      "name": "Product Analytics Foundations",
      "issuer": "Example Learning Lab",
      "date": "2024",
      "claimIds": ["ev-certificate"]
    }
  ],
  "evidence": [
    {
      "id": "ev-identity",
      "claim": "Asha Raman is a Product Analyst based in Bengaluru, India",
      "sourceType": "user-statement",
      "sourceStatus": "user-confirmed"
    },
    {
      "id": "ev-years",
      "claim": "Four years of relevant analytics experience",
      "sourceType": "user-statement",
      "sourceStatus": "user-confirmed"
    },
    {
      "id": "ev-domain",
      "claim": "Experience in mobility and learning products",
      "sourceType": "uploaded-resume",
      "sourceStatus": "verified"
    },
    {
      "id": "ev-tools",
      "claim": "Uses SQL, Python, experiment design, and dashboards at work",
      "sourceType": "portfolio",
      "sourceStatus": "verified"
    },
    {
      "id": "ev-product",
      "claim": "Experience with funnel analysis, customer research, and requirements discovery",
      "sourceType": "user-statement",
      "sourceStatus": "user-confirmed"
    },
    {
      "id": "ev-current-role",
      "claim": "Product Analyst at Meridian Mobility since July 2023",
      "sourceType": "uploaded-resume",
      "sourceStatus": "verified"
    },
    {
      "id": "ev-funnel",
      "claim": "Built the weekly activation funnel and identified two drop-off points",
      "sourceType": "portfolio",
      "sourceStatus": "verified"
    },
    {
      "id": "ev-experiment",
      "claim": "Checklist experiment increased first-week completion from 62% to 71%",
      "sourceType": "user-statement",
      "sourceStatus": "user-confirmed"
    },
    {
      "id": "ev-roadmap",
      "claim": "Analysis supported prioritization of three reliability fixes",
      "sourceType": "user-statement",
      "sourceStatus": "user-confirmed"
    },
    {
      "id": "ev-prior-role",
      "claim": "Data Analyst at Northstar Learning from June 2021 to June 2023",
      "sourceType": "uploaded-resume",
      "sourceStatus": "verified"
    },
    {
      "id": "ev-automation",
      "claim": "Reporting automation reduced preparation from two days to three hours",
      "sourceType": "user-statement",
      "sourceStatus": "user-confirmed"
    },
    {
      "id": "ev-adoption",
      "claim": "Defined adoption metrics for four course features",
      "sourceType": "user-statement",
      "sourceStatus": "user-confirmed"
    },
    {
      "id": "ev-project",
      "claim": "Built the Public Transit Reliability Explorer from February to May 2024",
      "sourceType": "portfolio",
      "sourceStatus": "verified"
    },
    {
      "id": "ev-education",
      "claim": "Bachelor of Engineering in Information Science, completed 2021",
      "sourceType": "transcript",
      "sourceStatus": "verified"
    },
    {
      "id": "ev-certificate",
      "claim": "Completed Product Analytics Foundations certificate in 2024",
      "sourceType": "certificate",
      "sourceStatus": "verified"
    }
  ],
  "target": {
    "role": "Product Analyst",
    "level": "Mid-level",
    "company": "Example Marketplace",
    "requirements": [
      {
        "text": "SQL and product funnel analysis",
        "status": "supported",
        "claimIds": ["ev-tools", "ev-funnel"]
      },
      {
        "text": "Experiment design and interpretation",
        "status": "supported",
        "claimIds": ["ev-experiment"]
      },
      {
        "text": "Marketplace pricing analytics",
        "status": "unsupported",
        "claimIds": []
      }
    ]
  },
  "meta": {
    "language": "en",
    "region": "india",
    "paperSize": "a4",
    "allowUnverified": false,
    "approvedClaimDigests": {
      "basics.identity": "401d9313c5b4a298186d72bd3d03d2e77809db452747b27a6d0f1d1ccd7f6faa",
      "basics.summary": "78e927e237bf87395b65439db1d30e9db2663848d6692a4ee05427ce2f2b8a4e",
      "skills[0]": "a3182e056440b49ec46ce0b63d153743273c9ba7ab92cc6d8603780c9d69a94f",
      "skills[1]": "5a62deda91c65982a1f1027a422f36b5fe1f08d8c1ade0e0d0cef1d74e73274b",
      "work[0]": "ae0a7497eda59095b25d9d53705b3ac24a002b590953eed14bab2a22652aebce",
      "work[0].highlights[0]": "46c9a6a792e72cb2fdb6cd466b77fa57e71c147c82eea3f41fda904ad500d4d1",
      "work[0].highlights[1]": "0ce611d452b765c1bc3c6486907e677a164b6a20b38f238b38c86ff5a31fe255",
      "work[0].highlights[2]": "491c7fa9534c1d72c1719ec358ff4fbb9972b7e2a992cebeffea605061061a2a",
      "work[1]": "daad032db234c5013966310a5f640c2c0048d07b00ca59e75a55818b790af041",
      "work[1].highlights[0]": "b55033b4ecf4edbf1bb707098d54ec998d9676ad5369c29eaf76ace6f76d8c7f",
      "work[1].highlights[1]": "78ca70480412a4d21291469fad09ea58d497045964c3b65765774454e4de306d",
      "projects[0]": "1f06bee526c33fe62afb7ca12b3608cf1d811a6d95808830d52a134e3fee08d0",
      "projects[0].highlights[0]": "27752f67affe92f525777d625f78afc1afa90b3f4a204bb9d0fcf4837b9b15c7",
      "education[0]": "24e35ed132280e78bfdaf78708223abc5bf48af08334e5d667452778a65f59e9",
      "certificates[0]": "64aea0a7e3d212935811b94511d2491e576d9ce26464a8a02440cb3bfa6e9f53"
    },
    "version": "1.2.0",
    "lastModified": "2026-08-01"
  }
}

